id,book_title,slug,author,cover_description,body,image_name,created,updated
115,Business Adventures: Twelve Classic Tales from the World of Wall Street,BusinessAdventuresTwelveClassicTalesfromtheWorldofWallStreet,"Brooks, John",Brief description entered here,Placeholder,BusinessAdventuresTwelveClassicTalesfromtheWorldofWallStreet.jpg,2020-07-27 15:59:09.051140+00:00,2020-07-29
116,The First American: The Life and Times of Benjamin Franklin,TheFirstAmericanTheLifeandTimesofBenjaminFranklin,"Brands, H.W.",Brief description entered here,Placeholder,TheFirstAmericanTheLifeandTimesofBenjaminFranklin.jpg,2020-07-27 15:59:09.055129+00:00,2020-07-29
117,Alexander Hamilton,AlexanderHamilton,"Chernow, Ron",Brief description entered here,Placeholder,AlexanderHamilton.jpg,2020-07-27 15:59:09.065102+00:00,2020-07-29
118,What Do You Care What Other People Think?,WhatDoYouCareWhatOtherPeopleThink?,"Feynman, Richard",Brief description entered here,Placeholder,WhatDoYouCareWhatOtherPeopleThink.jpg,2020-07-27 15:59:09.070089+00:00,2020-07-29
119,Fragile by Design: The Political Origins of Banking Crises and Scarce Credit,FragilebyDesignThePoliticalOriginsofBankingCrisesandScarceCredit,"Calomiris, Charles W.",Brief description entered here,Placeholder,FragilebyDesignThePoliticalOriginsofBankingCrisesandScarceCredit.jpg,2020-07-27 15:59:09.075076+00:00,2020-07-29
